source_list_slug,record_id,area,publication_time_text,year,title,authors,venue_pages,doi,link_primary,link_secondary,abstract_en_paraphrase,abstract_ja_summary,source_note,citation_key,note_file,subsystem,method_family,geometry,shielding_type,scanner_context,low_field_relevance,priority,access_status,acquisition_status,verification_status,kb_targets
gradient-and-shim-coil-design-papers-since-1990,G18,Gradient,2005,2005,A stream function method for gradient coil design,R. A. Lemdiasov; R. Ludwig,"Concepts in Magnetic Resonance Part B, 26B(1), 67–80",10.1002/cmr.b.20040,https://doi.org/10.1002/cmr.b.20040,,"This paper formulates gradient-coil design as an inverse problem for a surface stream function. A Biot–Savart based cost function is defined on an arbitrary current-carrying surface, and suitable weighting and linearization reduce the problem to a matrix equation. The stream-function solution is then converted into discrete winding paths.",任意の電流担持面上の stream function を未知量とする逆問題として、勾配コイル設計を定式化しています。Biot–Savart 則に基づくコスト関数を重み付け・線形化し、行列方程式として解きます。得られた stream function から離散巻線パターンを抽出します。,,Lemdiasov2005StreamFunctionGradient,literature/paper-notes/imported/gradient-and-shim-coil-design-papers-since-1990/2005-lemdiasov-stream-function-gradient.md,gradient,stream-function,unspecified,none-or-unspecified,general-mri,background,P2,unknown,not-needed,source-located,kb/hardware/design-methods.md;kb/hardware/gradients.md
gradient-and-shim-coil-design-papers-since-1990,G19,Gradient,2007,2007,Novel gradient coils designed using a boundary element method,M. Poole; R. Bowtell,"Concepts in Magnetic Resonance Part B, 31B(3), 162–175",10.1002/cmr.b.20091,https://doi.org/10.1002/cmr.b.20091,,"The authors use a boundary element method to design gradient coils on arbitrarily shaped surfaces. The surface is meshed, current density is represented by stream functions, and the optimizer can target Maxwell-consistent field variations while including resistance, inductance, torque, or shielding-related terms. Examples include asymmetric and shielded gradient surfaces.",境界要素法を用いて、任意形状面上の勾配コイルを設計する方法です。表面メッシュ上で stream function により電流密度を表し、Maxwell 方程式と整合する目標場を生成します。抵抗、インダクタンス、トルク、遮蔽に関する項を含められ、非対称・シールド付き勾配面の設計例が示されます。,,Poole2007NovelGradientDesignedBoundaryElement,literature/paper-notes/imported/gradient-and-shim-coil-design-papers-since-1990/2007-poole-novel-gradient-designed-boundary-element.md,gradient,boundary-element,unspecified,shielded-design,general-mri,bridge,P1,unknown,candidate,source-located,kb/hardware/design-methods.md;kb/hardware/gradients.md;kb/hardware/shielding.md
gradient-and-shim-coil-design-papers-since-1990,G20,Gradient,2009 May,2009,3D Gradient coil design – Toroidal surfaces,P. T. While; L. K. Forbes; S. Crozier,"Journal of Magnetic Resonance, 198(1), 31–40",10.1016/j.jmr.2009.01.006,https://doi.org/10.1016/j.jmr.2009.01.006,https://www.sciencedirect.com/science/article/pii/S1090780709000123,This paper develops an inverse design method for transverse gradient coils on toroidal surfaces. The optimization combines field-error control with regularization terms related to power and practical winding behavior. It explores unshielded and shielded designs for whole-body and head-scale MRI.,トロイダル面上の横方向勾配コイルを逆問題として設計する方法です。磁場誤差と、電力・巻線実装性に関する正則化項を組み合わせて最適化します。全身用および頭部用の非シールド・シールド付き設計を扱っています。,,While20093dGradientToroidalSurfaces,literature/paper-notes/imported/gradient-and-shim-coil-design-papers-since-1990/2009-while-3d-gradient-toroidal-surfaces.md,gradient,other,toroidal,shielded-design,general-mri,background,P2,unknown,not-needed,source-located,kb/hardware/design-methods.md;kb/hardware/gradients.md;kb/hardware/shielding.md
gradient-and-shim-coil-design-papers-since-1990,G21,Gradient,2010 Oct,2010,3D gradient coil design for open MRI systems,P. T. While; L. K. Forbes; S. Crozier,"Journal of Magnetic Resonance, 207(1), 124–133",10.1016/j.jmr.2010.08.017,https://doi.org/10.1016/j.jmr.2010.08.017,https://www.sciencedirect.com/science/article/abs/pii/S1090780710002739,"An analytic inverse method is presented for obtaining three-dimensional gradient coil geometries appropriate for open MRI. The design uses Fourier-series representations and Tikhonov regularization, with objectives such as field accuracy, power minimization, and optional shielding. Streamlines of the optimized current density provide implementable winding paths.",開放型 MRI 用の三次元勾配コイル形状を求める解析的逆設計法です。Fourier 級数表現と Tikhonov 正則化を用い、磁場精度、電力最小化、任意の遮蔽条件を扱います。最適化された電流密度の流線から実装可能な巻線経路を得ます。,,While20103dGradientOpenSystems,literature/paper-notes/imported/gradient-and-shim-coil-design-papers-since-1990/2010-while-3d-gradient-open-systems.md,gradient,other,unspecified,none-or-unspecified,open-mri,direct,P2,unknown,not-needed,source-located,kb/hardware/design-methods.md;kb/hardware/gradients.md;kb/hardware/shielding.md
gradient-and-shim-coil-design-papers-since-1990,G22,Gradient,2010,2010,Theory of gradient coil design methods for magnetic resonance imaging,S. S. Hidalgo-Tobon,"Concepts in Magnetic Resonance Part A, 36A(4), 223–242",10.1002/cmr.a.20163,https://doi.org/10.1002/cmr.a.20163,,"This review explains the theoretical basis of MRI gradient-coil design methods. It emphasizes the competing requirements of efficiency, slew rate, low inductance, linearity, low power, low eddy-current interaction, and mechanical/acoustic constraints. It is a compact entry point to the two decades of gradient design literature preceding 2010.",MRI 勾配コイル設計法の理論的基礎を解説する総説です。効率、スルーレート、低インダクタンス、線形性、低消費電力、渦電流との低結合、機械・音響制約など、互いに競合する要求を整理しています。2010 年以前の勾配設計文献への導入として有用です。,,Tobon2010TheoryGradientMagneticResonanceImaging,literature/paper-notes/imported/gradient-and-shim-coil-design-papers-since-1990/2010-tobon-theory-gradient-magnetic-resonance-imaging.md,gradient,review,unspecified,none-or-unspecified,general-mri,bridge,P1,unknown,candidate,source-located,kb/hardware/design-methods.md;kb/hardware/gradients.md
gradient-and-shim-coil-design-papers-since-1990,G23,Gradient,2012 Sep,2012,A finite difference method for the design of gradient coils in MRI—An initial framework,X. Zhu; L. Xia; W. Liu; S. Crozier,"IEEE Transactions on Biomedical Engineering, 59(9), 2412–2421",10.1109/TBME.2012.2188290,https://doi.org/10.1109/TBME.2012.2188290,https://pubmed.ncbi.nlm.nih.gov/22345557/,"The paper introduces a finite-difference framework for representing continuous current density in MRI gradient-coil design. A stream function is used to extract winding patterns after solving a regularized linear system. The framework supports biplanar, cylindrical, and less conventional coil geometries in a unified discretized formulation.",有限差分法により、MRI 勾配コイル設計における連続電流密度を表現する枠組みを導入しています。正則化線形方程式を解いた後、stream function から巻線パターンを抽出します。バイプラナ、円筒、非標準形状を統一的な離散化形式で扱えます。,,Zhu2012FiniteDifferenceGradientInitialFramework,literature/paper-notes/imported/gradient-and-shim-coil-design-papers-since-1990/2012-zhu-finite-difference-gradient-initial-framework.md,gradient,finite-difference,biplanar,none-or-unspecified,general-mri,bridge,P1,unknown,candidate,source-located,kb/hardware/design-methods.md;kb/hardware/gradients.md
gradient-and-shim-coil-design-papers-since-1990,G24,Gradient,2013,2013,Theoretical design of gradient coils with minimum power dissipation: accounting for the discretization of current density into coil windings,P. T. While; J. G. Korvink; N. J. Shah; M. S. Poole,"Journal of Magnetic Resonance, 235, 85–94",10.1016/j.jmr.2013.07.017,https://doi.org/10.1016/j.jmr.2013.07.017,,This work studies the gap between continuous-current-density optimization and the discrete winding patterns actually manufactured. It focuses on minimum-power gradient-coil design while accounting for the effect of contouring the current density into finite wire paths. The paper is relevant when stream-function designs must be converted into practical windings without losing predicted performance.,連続電流密度として最適化された設計と、実際に製作される離散巻線との間の差を扱う論文です。最小消費電力の勾配コイル設計において、stream function の等高線化が性能に与える影響を考慮します。連続解を実用巻線へ変換する際に重要です。,,While2013TheoreticalGradientMinimumPowerDissipation,literature/paper-notes/imported/gradient-and-shim-coil-design-papers-since-1990/2013-while-theoretical-gradient-minimum-power-dissipation.md,gradient,minimum-power,unspecified,none-or-unspecified,general-mri,background,P2,unknown,not-needed,source-located,kb/hardware/design-methods.md;kb/hardware/gradients.md
gradient-and-shim-coil-design-papers-since-1990,G25,Gradient / Shim,2014 Jul,2014,Convex optimisation of gradient and shim coil winding patterns,M. S. Poole et al.,"Journal of Magnetic Resonance, 244, 36–45",10.1016/j.jmr.2014.04.015,https://doi.org/10.1016/j.jmr.2014.04.015,https://pubmed.ncbi.nlm.nih.gov/24880337/,"This paper combines boundary-element coil modeling with convex optimization to design both gradient and shim winding patterns. It compares cost functions and constraints, including lp-norm style regularization. Sparse or evenly distributed wire patterns can be encouraged, making the method useful when wire width, manufacturability, or local density constraints matter.",境界要素法によるコイルモデルと凸最適化を組み合わせ、勾配コイルとシムコイルの巻線パターンを設計します。lp ノルム型の正則化など、目的関数と制約を比較します。疎な巻線や均一な巻線分布を誘導でき、ワイヤ幅、製作性、局所密度制約が重要な場合に有用です。,,Poole2014ConvexOptimisationGradientShimWinding,literature/paper-notes/imported/gradient-and-shim-coil-design-papers-since-1990/2014-poole-convex-optimisation-gradient-shim-winding.md,gradient-and-b0-field-control,convex-optimization,unspecified,none-or-unspecified,general-mri,bridge,P1,unknown,candidate,source-located,kb/hardware/design-methods.md;kb/hardware/gradients.md;kb/hardware/b0-field-control.md
gradient-and-shim-coil-design-papers-since-1990,G26,Gradient,2016 Aug,2016,"Asymmetric gradient coil design for use in a short, open bore magnetic resonance imaging scanner",W. Wang et al.,"Journal of Magnetic Resonance, 269, 203–212",10.1016/j.jmr.2016.06.015,https://doi.org/10.1016/j.jmr.2016.06.015,https://www.sciencedirect.com/science/article/pii/S109078071630112X,"The paper addresses the reduced imaging volume of short-bore scanners by designing asymmetric gradients that place a full-size imaging region closer to the coil end. The optimized, connected coil layouts loosen geometric restrictions and improve electromagnetic performance for short open-bore MRI. The work is relevant to access-constrained magnet architectures.",短ボア MRI で撮像可能領域が制限される問題に対し、コイル端部近傍に十分な撮像領域を置ける非対称勾配設計を提案しています。接続された最適化巻線により、配置制約を緩和し電磁性能を改善します。アクセス制約の強い磁石構成に関係します。,,Wang2016AsymmetricGradientUseShortOpen,literature/paper-notes/imported/gradient-and-shim-coil-design-papers-since-1990/2016-wang-asymmetric-gradient-use-short-open.md,gradient,other,short-open-bore,none-or-unspecified,open-bore,direct,P2,unknown,not-needed,source-located,kb/hardware/design-methods.md;kb/hardware/gradients.md
gradient-and-shim-coil-design-papers-since-1990,G27,Gradient / Shim,2018 Mar,2018,Gradient and shim technologies for ultra high field MRI,S. A. M. Winkler et al.,"NeuroImage, 168, 59–70",10.1016/j.neuroimage.2016.11.033,https://doi.org/10.1016/j.neuroimage.2016.11.033,https://www.sciencedirect.com/science/article/pii/S1053811916306502,"This review covers gradient and shim technology for ultra-high-field MRI. It discusses modeling, construction, Lorentz forces, vibration and acoustic noise, eddy currents, peripheral nerve stimulation, and insert gradient concepts. It is a useful cross-reference because high-field systems make both gradient performance and B0 homogenization more demanding.",超高磁場 MRI における勾配・シム技術の総説です。モデリング、製作、Lorentz 力、振動・騒音、渦電流、末梢神経刺激、挿入型勾配コイルを扱います。高磁場では勾配性能と B0 均一化の要求が厳しくなるため、両者を同時に俯瞰できる文献です。,,Winkler2018GradientShimTechnologiesUltraHigh,literature/paper-notes/imported/gradient-and-shim-coil-design-papers-since-1990/2018-winkler-gradient-shim-technologies-ultra-high.md,gradient-and-b0-field-control,review,unspecified,eddy-current-mitigation,uhf,bridge,P1,unknown,candidate,source-located,kb/hardware/design-methods.md;kb/hardware/gradients.md;kb/hardware/b0-field-control.md;kb/hardware/shielding.md
gradient-and-shim-coil-design-papers-since-1990,G28,Gradient,2021 Jul,2021,Minimum electric-field gradient coil design: Theoretical limits and practical guidelines,P. B. Roemer; B. K. Rutt,"Magnetic Resonance in Medicine, 86(1), 569–580",10.1002/mrm.28681,https://doi.org/10.1002/mrm.28681,https://pubmed.ncbi.nlm.nih.gov/33604991/,"This paper incorporates induced electric-field calculations directly into gradient-coil design. The design objective constrains peak electric field while preserving imaging-field constraints, allowing exploration of theoretical limits related to peripheral nerve stimulation. Asymmetric winding solutions can reduce E-field exposure for a given gradient requirement.",誘導電場計算を勾配コイル設計に直接組み込んだ論文です。撮像に必要な勾配場制約を維持しながらピーク電場を制約し、末梢神経刺激に関係する理論限界を探索します。非対称巻線により、同じ勾配要求に対して電場曝露を下げられる可能性を示しています。,,Roemer2021MinimumElectricFieldGradientTheoretical,literature/paper-notes/imported/gradient-and-shim-coil-design-papers-since-1990/2021-roemer-minimum-electric-field-gradient-theoretical.md,gradient,other,unspecified,none-or-unspecified,general-mri,background,P2,unknown,not-needed,source-located,kb/hardware/design-methods.md;kb/hardware/gradients.md
gradient-and-shim-coil-design-papers-since-1990,G29,Gradient,2021,2021,Methods: Of Stream Functions and Thin Wires: An Intuitive Approach to Gradient Coil Design,S. Littin et al.,"Frontiers in Physics, 9, 699468",10.3389/fphy.2021.699468,https://doi.org/10.3389/fphy.2021.699468,https://www.frontiersin.org/articles/10.3389/fphy.2021.699468/full,This methods paper provides an intuitive and open-source-oriented route from surface current density to stream functions and thin-wire gradient windings. It demonstrates how inverse coil design can be implemented on simple surfaces and several topologies. The value is mainly pedagogical and reproducibility-oriented for stream-function based gradient design.,表面電流密度から stream function、さらに細線巻線へ変換する流れを、直感的かつオープンソース志向で説明した方法論文です。単純面や複数の表面トポロジーで逆問題型コイル設計を実装する例を示します。stream function 型勾配設計の教育・再現性に価値があります。,,Littin2021StreamFunctionsThinWiresIntuitive,literature/paper-notes/imported/gradient-and-shim-coil-design-papers-since-1990/2021-littin-stream-functions-thin-wires-intuitive.md,gradient,stream-function,unspecified,none-or-unspecified,general-mri,background,P2,unknown,not-needed,source-located,kb/hardware/design-methods.md;kb/hardware/gradients.md
gradient-and-shim-coil-design-papers-since-1990,G30,Gradient,2022,2022,A theoretical framework of gradient coil designed to mitigate eddy currents for a permanent magnet MRI system,P. Zhang; W. Wang; Y. Shi,"Technology and Health Care, 30(1_suppl)",10.3233/THC-THC228030,https://doi.org/10.3233/THC-THC228030,https://journals.sagepub.com/doi/10.3233/THC-THC228030,The authors develop a planar-gradient design framework for permanent-magnet MRI systems where active shielding may be geometrically difficult. A mirror-image magnetostatic model and finite-difference stream-function formulation are used to reduce eddy currents in conductive plates and pole pieces. The method aims at minimum power dissipation and magnetic energy under practical spacing constraints.,能動シールドを配置しにくい永久磁石 MRI 向けに、平面勾配コイルの渦電流低減設計枠組みを提案しています。磁気静的ミラーイメージモデルと有限差分 stream function を用い、導体板やポールピースの渦電流を抑えます。実装空間制約下で、消費電力と磁気エネルギーを小さくする設計です。,,Zhang2022TheoreticalFrameworkGradientDesignedMitigate,literature/paper-notes/imported/gradient-and-shim-coil-design-papers-since-1990/2022-zhang-theoretical-framework-gradient-designed-mitigate.md,gradient,minimum-power,planar,active-shielding,permanent-magnet,direct,P0,purchase-required,candidate,source-located,kb/hardware/design-methods.md;kb/hardware/gradients.md;kb/hardware/shielding.md
gradient-and-shim-coil-design-papers-since-1990,G31,Gradient,2023,2023,Gradient coil design with enhanced shielding constraint for a cryogen-free superconducting MRI system,W. Wang et al.,"Magnetic Resonance Letters, 4(1), 100086",10.1016/j.mrl.2023.09.001,https://doi.org/10.1016/j.mrl.2023.09.001,https://www.sciencedirect.com/science/article/pii/S2772528623000462,This paper proposes enhanced shielding constraints for gradient coils in cryogen-free superconducting MRI. Regionalized stray-field constraints are added so the optimized coil suppresses leakage in particularly sensitive regions without a large increase in winding complexity. The design is validated through a built gradient assembly and imaging assessment.,無冷媒超電導 MRI 用の勾配コイルに、強化された遮蔽制約を導入する研究です。敏感な領域ごとに漏洩磁場制約を設定し、巻線複雑性を大きく増やさずに外部磁場を低減します。勾配アセンブリの製作と画像評価により設計を検証しています。,,Wang2023GradientEnhancedShieldingConstraintCryogen,literature/paper-notes/imported/gradient-and-shim-coil-design-papers-since-1990/2023-wang-gradient-enhanced-shielding-constraint-cryogen.md,gradient,other,unspecified,none-or-unspecified,general-mri,background,P2,unknown,not-needed,source-located,kb/hardware/design-methods.md;kb/hardware/gradients.md;kb/hardware/shielding.md
gradient-and-shim-coil-design-papers-since-1990,G32,Gradient,2023 Sep,2023,A Stream Function Smoothing Method for the Design of MRI Gradient Coils on Non-Developable Surfaces,H. Yang; X. Ren; S. Zuo; W. Liu,"Sensors, 23(18), 7912",10.3390/s23187912,https://doi.org/10.3390/s23187912,https://www.mdpi.com/1424-8220/23/18/7912,"The paper addresses winding extraction on non-developable surfaces, where raw stream-function contours can be difficult to manufacture. A smoothing operator based on the Laplace–Beltrami framework is applied to implicit stream functions before contour extraction. The method balances field accuracy, power, wire spacing, and wire curvature on complex coil surfaces.",非可展面上の勾配コイルで、stream function の等高線が製作困難になりやすい問題を扱います。Laplace–Beltrami 型の平滑化作用素を stream function に適用してから等高線を抽出します。複雑曲面で、磁場精度、電力、ワイヤ間隔、曲率を同時に改善することを狙います。,,Yang2023StreamFunctionSmoothingGradientNon,literature/paper-notes/imported/gradient-and-shim-coil-design-papers-since-1990/2023-yang-stream-function-smoothing-gradient-non.md,gradient,stream-function,non-developable-surface,none-or-unspecified,general-mri,background,P2,unknown,not-needed,source-located,kb/hardware/design-methods.md;kb/hardware/gradients.md
gradient-and-shim-coil-design-papers-since-1990,G33,Gradient,2024 Jul,2024,Designing gradient coils with the shape derivative and the closed B-spline curves,T. Takahashi,"Magnetic Resonance Imaging, 110, 112–127",10.1016/j.mri.2024.03.042,https://doi.org/10.1016/j.mri.2024.03.042,https://www.sciencedirect.com/science/article/pii/S0730725X24000422,"This paper treats discrete gradient-coil design as a shape-optimization problem. The derivative of the Bz gradient with respect to coil shape is derived, and closed B-spline curves are used so their control points become nonlinear-programming variables. The approach offers a gradient-based alternative to purely contour-based or stochastic winding optimization.",離散勾配コイル設計を形状最適化問題として扱う論文です。コイル形状に対する Bz 勾配の形状微分を導出し、閉 B-spline 曲線の制御点を非線形計画問題の設計変数とします。等高線抽出や確率的探索に対する、勾配ベースの代替アプローチです。,,Takahashi2024DesigningGradientShapeDerivativeClosed,literature/paper-notes/imported/gradient-and-shim-coil-design-papers-since-1990/2024-takahashi-designing-gradient-shape-derivative-closed.md,gradient,shape-derivative,unspecified,none-or-unspecified,general-mri,background,P2,unknown,not-needed,source-located,kb/hardware/design-methods.md;kb/hardware/gradients.md
gradient-and-shim-coil-design-papers-since-1990,G34,Gradient,2025 Jun,2025,Design method of magnetic resonance biplanar gradient coil based on target field method and stream function,Q. Huang et al.,"Frontiers in Physics, 13, 1579043",10.3389/fphy.2025.1579043,https://doi.org/10.3389/fphy.2025.1579043,https://www.frontiersin.org/journals/physics/articles/10.3389/fphy.2025.1579043/full,"The authors combine a target-field point method with stream-function theory to design biplanar gradient coils. Inverse simulation is used to obtain a winding distribution, followed by solid modeling and orthogonal analysis. The design is iteratively adjusted for linearity, efficiency, and uniformity within the desired spherical volume.",ターゲットフィールド点法と stream function 理論を組み合わせ、バイプラナ勾配コイルを設計しています。逆解析で巻線分布を求めた後、ソリッドモデル化と直交分析を行います。DSV 内の線形性、効率、均一性を反復的に改善する設計手順です。,,Huang2025MagneticResonanceBiplanarGradientTarget,literature/paper-notes/imported/gradient-and-shim-coil-design-papers-since-1990/2025-huang-magnetic-resonance-biplanar-gradient-target.md,gradient,stream-function,biplanar,none-or-unspecified,general-mri,direct,P0,open-access,not-needed,verified,kb/hardware/design-methods.md;kb/hardware/gradients.md
gradient-and-shim-coil-design-papers-since-1990,G35,Gradient,2025 Oct,2025,Gradient coil design for a 0.23 T NICU MRI system using an improved two-step Target-Field Method with enhanced linearity and compact design,Jinhao Liu; Miutian Wang; Wenchen Wang; Yaohui Wang; Weimin Wang; Feng Liu,"Journal of Magnetic Resonance, 379, 107936",10.1016/j.jmr.2025.107936,https://doi.org/10.1016/j.jmr.2025.107936,https://www.sciencedirect.com/science/article/pii/S1090780725001089,This paper targets a compact neonatal intensive care unit MRI system at 0.23 T. It uses a two-step target-field method: a Tikhonov-regularized linear solve followed by nonlinear constrained optimization. The goal is to improve absolute and relative gradient linearity while accommodating compact geometry and finite gradient thickness.,0.23 T の NICU 向けコンパクト MRI を対象とする勾配コイル設計です。Tikhonov 正則化を伴う線形解法と、その後の制約付き非線形最適化からなる二段階ターゲットフィールド法を用います。小型形状と有限厚みを考慮しつつ、絶対・相対線形性を改善することを目指します。,,Liu2025Gradient023TNicu,literature/paper-notes/imported/gradient-and-shim-coil-design-papers-since-1990/2025-liu-gradient-0-23-t-nicu.md,gradient,target-field,unspecified,none-or-unspecified,nicu,direct,P0,purchase-required,candidate,source-located,kb/hardware/design-methods.md;kb/hardware/gradients.md
