source_list_slug,record_id,area,publication_time_text,year,title,authors,venue_pages,doi,link_primary,link_secondary,abstract_en_paraphrase,abstract_ja_summary,source_note,citation_key,note_file,subsystem,method_family,geometry,shielding_type,scanner_context,low_field_relevance,priority,access_status,acquisition_status,verification_status,kb_targets
gradient-and-shim-coil-design-papers-since-1990,S01,Shim,1994 May,1994,Accurate Shim-Coil Design and Magnet-Field Profiling by a Power-Minimization-Matrix Method,D. I. Hoult; D. Deslauriers,"Journal of Magnetic Resonance, Series A, 108(1), 9–20",10.1006/jmra.1994.1082,https://doi.org/10.1006/jmra.1994.1082,https://www.sciencedirect.com/science/article/pii/S1064185884710820,This paper presents a power-minimization matrix method for designing shim coils that correct measured magnet inhomogeneity. The method uses basis functions and matrix optimization to obtain a current distribution that cancels unwanted field terms with minimum power. It also links shim-coil design with magnet-field profiling and practical correction strategies.,測定された磁石不均一を補正するシムコイルを、最小電力の行列法で設計する論文です。基底関数と行列最適化を用い、不要な磁場成分を最小電力で打ち消す電流分布を求めます。シムコイル設計と磁場プロファイリングを結びつける実用的な補正法です。,,Hoult1994AccurateShimMagnetFieldProfiling,literature/paper-notes/imported/gradient-and-shim-coil-design-papers-since-1990/1994-hoult-accurate-shim-magnet-field-profiling.md,b0-field-control,power-minimization,unspecified,none-or-unspecified,general-mri,background,P2,unknown,not-needed,source-located,kb/hardware/design-methods.md;kb/hardware/b0-field-control.md
gradient-and-shim-coil-design-papers-since-1990,S02,Shim,1995 Aug,1995,Shim coils for NMR and MRI solenoid magnets,P. Konzbul; K. Švéda,"Measurement Science and Technology, 6(8), 1116–1123",10.1088/0957-0233/6/8/005,https://doi.org/10.1088/0957-0233/6/8/005,,This paper treats shim-coil design for solenoidal NMR and MRI magnets. It belongs to the classical line of work in which specific harmonic correction fields are generated by tailored current distributions on cylindrical surfaces. It is useful for understanding the relation between conventional solenoid-magnet shims and later MRI-specific target-field methods.,NMR および MRI のソレノイド磁石向けシムコイル設計を扱う論文です。円筒面上の電流分布で特定の調和補正場を生成する古典的な設計系譜に属します。従来のソレノイド磁石用シムと、後の MRI 向けターゲットフィールド法との接続を理解するのに有用です。,,Konzbul1995ShimNmrSolenoidMagnets,literature/paper-notes/imported/gradient-and-shim-coil-design-papers-since-1990/1995-konzbul-shim-nmr-solenoid-magnets.md,b0-field-control,target-field,cylindrical,none-or-unspecified,general-mri,background,P2,unknown,not-needed,source-located,kb/hardware/design-methods.md;kb/hardware/b0-field-control.md
gradient-and-shim-coil-design-papers-since-1990,S03,Shim,2001 Aug,2001,Asymmetric zonal shim coils for magnetic resonance applications,L. K. Forbes; S. Crozier,"Medical Physics, 28(8), 1644–1651",10.1118/1.1388538,https://doi.org/10.1118/1.1388538,https://pubmed.ncbi.nlm.nih.gov/11548933/,"The authors give a systematic Fourier-series design method for asymmetric zonal shim coils on finite cylinders. A desired field is specified over a nonsymmetric axial portion of the coil, and the current density and winding patterns follow from calculated Fourier coefficients. The method supports head-only and asymmetric magnet systems.",有限円筒上の非対称 zonal シムコイルを、Fourier 級数により系統的に設計する方法です。コイル長の非対称な軸方向領域に目標場を指定し、Fourier 係数から電流密度と巻線パターンを得ます。頭部専用磁石や非対称磁石系に適用しやすい設計です。,,Forbes2001AsymmetricZonalShimMagneticResonance,literature/paper-notes/imported/gradient-and-shim-coil-design-papers-since-1990/2001-forbes-asymmetric-zonal-shim-magnetic-resonance.md,b0-field-control,other,head-only,none-or-unspecified,head-only,background,P2,unknown,not-needed,source-located,kb/hardware/design-methods.md;kb/hardware/b0-field-control.md
gradient-and-shim-coil-design-papers-since-1990,S04,Shim,2001 Dec,2001,A novel target-field method for finite-length magnetic resonance shim coils: I. Zonal shims,L. K. Forbes; S. Crozier,"Journal of Physics D: Applied Physics, 34(24), 3447–3455",10.1088/0022-3727/34/24/305,https://doi.org/10.1088/0022-3727/34/24/305,https://eurekamag.com/research/098/987/098987476.php,"This paper introduces a target-field method for genuinely finite-length magnetic resonance shim and gradient coils. A cylindrical target region can be placed asymmetrically inside a finite coil, and a desired field is specified on its surface. A regularized minimization produces the surface current density for zonal fields such as linear, quadratic, and cubic components.",有限長の磁気共鳴シム・勾配コイルを設計するターゲットフィールド法を導入しています。有限長コイル内の任意位置に円筒状ターゲット領域を置き、その表面上に目標磁場を指定します。正則化付き最小化により、線形、二次、三次などの zonal 成分を生成する表面電流密度を求めます。,,Forbes2001NovelTargetFieldFiniteLength,literature/paper-notes/imported/gradient-and-shim-coil-design-papers-since-1990/2001-forbes-novel-target-field-finite-length.md,b0-field-control,target-field,cylindrical,none-or-unspecified,general-mri,background,P2,unknown,not-needed,source-located,kb/hardware/design-methods.md;kb/hardware/b0-field-control.md
gradient-and-shim-coil-design-papers-since-1990,S05,Shim,2002 May,2002,A novel target-field method for finite-length magnetic resonance shim coils: II. Tesseral shims,L. K. Forbes; S. Crozier,"Journal of Physics D: Applied Physics, 35(9), 839–849",10.1088/0022-3727/35/9/303,https://doi.org/10.1088/0022-3727/35/9/303,,The second paper extends the finite-length target-field method to tesseral shim fields. It avoids assuming an ideal infinitely long geometry and allows asymmetric target regions and fields specified on more than one radius. The method provides winding patterns for higher-order tesseral shim terms in realistic finite coils.,有限長ターゲットフィールド法を tesseral シム場へ拡張した論文です。無限長コイル近似に依存せず、非対称ターゲット領域や複数半径上で指定した目標場を扱えます。現実的な有限長コイルで高次 tesseral シム項の巻線パターンを得る方法です。,,Forbes2002NovelTargetFieldFiniteLength,literature/paper-notes/imported/gradient-and-shim-coil-design-papers-since-1990/2002-forbes-novel-target-field-finite-length.md,b0-field-control,target-field,unspecified,none-or-unspecified,general-mri,background,P2,unknown,not-needed,source-located,kb/hardware/design-methods.md;kb/hardware/b0-field-control.md
gradient-and-shim-coil-design-papers-since-1990,S06,Shim,2002,2002,NMR shim coil design utilising a rapid spherical harmonic calculation method,C. J. Snape-Jenkinson; S. Crozier; L. K. Forbes,"The ANZIAM Journal, 43(3), 375–386",10.1017/S1446181100012578,https://doi.org/10.1017/S1446181100012578,https://www.cambridge.org/core/journals/anziam-journal/article/nmr-shim-coil-design-utilising-a-rapid-spherical-harmonic-calculation-method/7305DDB8F04A05445E7C034332076475,The paper uses a rapid spherical-harmonic calculation method to design shim coils from circular-arc conductors. Simulated annealing is used to locate current-carrying arcs so that undesired harmonic terms are minimized while the desired shim term remains. The method is flexible for both zonal and tesseral fields.,円弧状導体からなるシムコイルを、高速な球面調和関数計算法で設計します。シミュレーテッドアニーリングにより電流円弧の位置を決め、目的のシム項を保ちながら不要な調和成分を小さくします。zonal と tesseral の両方に対応できる柔軟な方法です。,,Jenkinson2002NmrShimUtilisingRapidSpherical,literature/paper-notes/imported/gradient-and-shim-coil-design-papers-since-1990/2002-jenkinson-nmr-shim-utilising-rapid-spherical.md,b0-field-control,simulated-annealing,unspecified,none-or-unspecified,general-mri,background,P2,unknown,not-needed,source-located,kb/hardware/design-methods.md;kb/hardware/b0-field-control.md
gradient-and-shim-coil-design-papers-since-1990,S07,Shim,2002,2002,Determining complicated winding patterns for shim coils using stream functions and the target-field method,M. A. Brideson; L. K. Forbes; S. Crozier,"Concepts in Magnetic Resonance, 14(1), 9–18",10.1002/cmr.10000,https://doi.org/10.1002/cmr.10000,,This paper combines stream functions with the target-field method to derive complicated shim-coil winding patterns. It is aimed at cases where desired field shapes and finite geometry make traditional simple harmonic windings inadequate. The stream-function representation provides a direct route from optimized surface current density to manufacturable contours.,stream function とターゲットフィールド法を組み合わせ、複雑なシムコイル巻線パターンを求める方法です。目標磁場形状や有限形状のために単純な調和巻線では不十分な場合を想定しています。最適化された表面電流密度から製作可能な等高線巻線へ直接変換できます。,,Brideson2002DeterminingComplicatedWindingPatternsShim,literature/paper-notes/imported/gradient-and-shim-coil-design-papers-since-1990/2002-brideson-determining-complicated-winding-patterns-shim.md,b0-field-control,stream-function,unspecified,none-or-unspecified,general-mri,background,P2,unknown,not-needed,source-located,kb/hardware/design-methods.md;kb/hardware/b0-field-control.md
gradient-and-shim-coil-design-papers-since-1990,S08,Shim,2003 Jan,2003,A novel target-field method for magnetic resonance shim coils: III. Shielded zonal and tesseral coils,L. K. Forbes; S. Crozier,"Journal of Physics D: Applied Physics, 36(2), 68–80",10.1088/0022-3727/36/2/302,https://doi.org/10.1088/0022-3727/36/2/302,,The third paper in the series adds active shielding to finite-length zonal and tesseral shim-coil design. Primary and shield winding patterns are designed so the desired target field is generated inside the target region while the field outside the shield is suppressed. The approach extends the finite-length target-field method to shielded shim hardware.,有限長 zonal/tesseral シムコイル設計に能動遮蔽を加えたシリーズ第 3 論文です。一次巻線とシールド巻線を同時に設計し、内部ターゲット領域では目標場を作り、シールド外側では磁場を抑制します。有限長ターゲットフィールド法をシールド付きシムハードウェアへ拡張しています。,,Forbes2003NovelTargetFieldMagneticResonance,literature/paper-notes/imported/gradient-and-shim-coil-design-papers-since-1990/2003-forbes-novel-target-field-magnetic-resonance.md,b0-field-control,target-field,unspecified,active-shielding,general-mri,background,P2,unknown,not-needed,source-located,kb/hardware/design-methods.md;kb/hardware/b0-field-control.md;kb/hardware/shielding.md
gradient-and-shim-coil-design-papers-since-1990,S09,Shim,2004 Sep,2004,Shim design using a linear programming algorithm,S. E. Ungersma et al.,"Magnetic Resonance in Medicine, 52(3), 619–627",10.1002/mrm.20176,https://doi.org/10.1002/mrm.20176,https://pubmed.ncbi.nlm.nih.gov/15334583/,"A linear-programming algorithm is introduced for designing resistive shim coils on arbitrary surfaces. The method can target shim fields of any order over an arbitrary ROI and tends to produce sparse, constructible current patterns. Examples include specialized knee and head-imaging magnet geometries.",任意面上の抵抗性シムコイルを線形計画法で設計する手法です。任意 ROI 上で任意次数のシム場を目標にでき、構成しやすい疎な電流パターンを得やすい点が特徴です。膝用磁石や頭部用磁石など、特殊形状の設計例を扱っています。,,Ungersma2004ShimLinearProgrammingAlgorithm,literature/paper-notes/imported/gradient-and-shim-coil-design-papers-since-1990/2004-ungersma-shim-linear-programming-algorithm.md,b0-field-control,linear-programming,unspecified,none-or-unspecified,general-mri,background,P2,unknown,not-needed,source-located,kb/hardware/design-methods.md;kb/hardware/b0-field-control.md
gradient-and-shim-coil-design-papers-since-1990,S10,Shim,2005 Feb,2005,Mitigation of susceptibility-induced signal loss in neuroimaging using localized shim coils,J. J. Hsu; G. H. Glover,"Magnetic Resonance in Medicine, 53(2), 243–248",10.1002/mrm.20365,https://doi.org/10.1002/mrm.20365,https://pubmed.ncbi.nlm.nih.gov/15678595/,The paper demonstrates localized resistive shim coils for reducing susceptibility-induced B0 inhomogeneity in neuroimaging. Coils placed close to problematic anatomy are optimized in situ for patient-specific correction. The approach improves field homogeneity and recovers signal in regions that are difficult for global spherical-harmonic shims.,神経画像で感受率由来の B0 不均一による信号低下を低減するため、局所抵抗シムコイルを用います。問題部位に近い位置へコイルを置き、被験者ごとの in situ 最適化を行います。全体的な球面調和シムでは補正しにくい領域の均一性改善と信号回復を狙います。,,Hsu2005MitigationSusceptibilityInducedSignalLoss,literature/paper-notes/imported/gradient-and-shim-coil-design-papers-since-1990/2005-hsu-mitigation-susceptibility-induced-signal-loss.md,b0-field-control,other,localized-array,none-or-unspecified,general-mri,background,P2,unknown,not-needed,source-located,kb/hardware/design-methods.md;kb/hardware/b0-field-control.md
gradient-and-shim-coil-design-papers-since-1990,S11,Shim,2010 Apr,2010,Quantitative Comparison of Minimum Inductance and Minimum Power Algorithms for the Design of Shim Coils for Small Animal Imaging,P. Hudson; S. D. Hudson; W. B. Handler; T. J. Scholl; B. A. Chronik,"Concepts in Magnetic Resonance Part B, 37B(2), 65–74",10.1002/cmr.b.20159,https://doi.org/10.1002/cmr.b.20159,https://pmc.ncbi.nlm.nih.gov/articles/PMC2857351/,"This paper compares minimum-inductance and minimum-power target-field algorithms for high-order shim sets designed for small-animal imaging. The authors evaluate inductive and resistive merits for multiple shim axes and compare continuous and discretized winding patterns. Minimum-power designs reduce dissipation, while minimum-inductance designs favor switching speed; the observed performance differences are generally modest.",小動物イメージング用の高次シムセットについて、最小インダクタンス法と最小電力法を定量比較しています。複数シム軸でインダクタンス指標と抵抗指標を評価し、連続解と離散巻線も比較します。最小電力設計は発熱・消費電力を下げ、最小インダクタンス設計は高速切替に有利ですが、性能差は比較的小さいとされています。,,Hudson2010QuantitativeComparisonMinimumInductanceMinimum,literature/paper-notes/imported/gradient-and-shim-coil-design-papers-since-1990/2010-hudson-quantitative-comparison-minimum-inductance-minimum.md,b0-field-control,target-field,unspecified,none-or-unspecified,small-animal,background,P2,unknown,not-needed,source-located,kb/hardware/design-methods.md;kb/hardware/b0-field-control.md
gradient-and-shim-coil-design-papers-since-1990,S12,Shim,2010 Jan,2010,Magnetic Field Homogenization of the Human Prefrontal Cortex with a Set of Localized Electrical Coils,C. Juchem et al.,"Magnetic Resonance in Medicine, 63(1), 171–180",10.1002/mrm.22164,https://doi.org/10.1002/mrm.22164,https://pubmed.ncbi.nlm.nih.gov/19918903/,"The authors use localized electrical coils to homogenize the human prefrontal cortex, where susceptibility gradients are strong. The local coils generate high-amplitude correction fields close to the target while minimizing undesired effects elsewhere. Combined with low-order spherical-harmonic shimming, the approach reduces signal dropout in high-field gradient-echo imaging.",感受率勾配の強いヒト前頭前野を均一化するため、局所電気コイルを用いる研究です。局所コイルはターゲット近傍で大きな補正場を生成し、他領域への影響を小さく保ちます。低次球面調和シムと組み合わせることで、高磁場 gradient-echo 画像の信号欠落を低減します。,,Juchem2010MagneticFieldHomogenizationHumanPrefrontal,literature/paper-notes/imported/gradient-and-shim-coil-design-papers-since-1990/2010-juchem-magnetic-field-homogenization-human-prefrontal.md,b0-field-control,other,localized-array,none-or-unspecified,general-mri,background,P2,unknown,not-needed,source-located,kb/hardware/design-methods.md;kb/hardware/b0-field-control.md
gradient-and-shim-coil-design-papers-since-1990,S13,Shim / Encoding,2010 Jun,2010,Magnetic field modeling with a set of individual localized coils,C. Juchem; T. W. Nixon; A. C. McIntyre; R. A. de Graaf,"Journal of Magnetic Resonance, 204(2), 281–289",10.1016/j.jmr.2010.03.008,https://doi.org/10.1016/j.jmr.2010.03.008,https://pubmed.ncbi.nlm.nih.gov/20347360/,"This paper models magnetic fields generated by many independent localized coils. The same basis of individual coil fields can synthesize shim fields and, in some cases, spatial-encoding gradients. The study anticipates multi-coil field control, where the effective volume and correction field can be adapted by optimizing currents rather than by relying only on fixed spherical-harmonic hardware.",多数の独立した局所コイルが生成する磁場をモデル化しています。個別コイル場の基底を使って、シム場だけでなく場合によっては空間エンコード勾配も合成できます。固定的な球面調和ハードウェアだけでなく、電流最適化により有効体積や補正場を変えられる multi-coil field control の基礎となる研究です。,,Juchem2010MagneticFieldModelingSetIndividual,literature/paper-notes/imported/gradient-and-shim-coil-design-papers-since-1990/2010-juchem-magnetic-field-modeling-set-individual.md,b0-field-control,other,localized-array,none-or-unspecified,general-mri,background,P2,unknown,not-needed,source-located,kb/hardware/design-methods.md;kb/hardware/b0-field-control.md
gradient-and-shim-coil-design-papers-since-1990,S14,Shim,2011 Sep,2011,Multicoil shimming of the mouse brain,C. Juchem et al.,"Magnetic Resonance in Medicine, 66(3), 893–900",10.1002/mrm.22850,https://doi.org/10.1002/mrm.22850,https://pubmed.ncbi.nlm.nih.gov/21394781/,A 48-coil local shim array is used for static and dynamic shimming of the mouse brain at high field. The multi-coil basis reduces residual B0 distortions more effectively than conventional second-order spherical-harmonic shimming. The paper demonstrates improved gradient-echo signal recovery and localized correction flexibility.,高磁場でマウス脳の静的・動的シミングを行うため、48 個の局所コイルアレイを用います。multi-coil 基底は従来の 2 次球面調和シムより残留 B0 歪みを低減します。gradient-echo 信号の回復と、局所補正の柔軟性を示しています。,,Juchem2011MulticoilShimmingMouseBrain,literature/paper-notes/imported/gradient-and-shim-coil-design-papers-since-1990/2011-juchem-multicoil-shimming-mouse-brain.md,b0-field-control,multicoil,localized-array,none-or-unspecified,general-mri,background,P2,unknown,not-needed,source-located,kb/hardware/design-methods.md;kb/hardware/b0-field-control.md
gradient-and-shim-coil-design-papers-since-1990,S15,Shim,2011 Oct,2011,Dynamic multi-coil shimming of the human brain at 7 T,C. Juchem et al.,"Journal of Magnetic Resonance, 212(2), 280–288",10.1016/j.jmr.2011.07.005,https://doi.org/10.1016/j.jmr.2011.07.005,https://pubmed.ncbi.nlm.nih.gov/21840753/,"The authors demonstrate dynamic slice-specific shimming of the human brain at 7 T using an array of 48 localized coils. Non-orthogonal coil basis fields are optimized for each slice, reducing B0 inhomogeneity beyond what is possible with dynamic low-order spherical-harmonic shims. The paper is central for multi-coil B0 control at ultra-high field.",7 T ヒト脳で、48 個の局所コイルアレイによるスライスごとの動的シミングを示しています。非直交のコイル基底場を各スライスで最適化し、低次球面調和シムの動的補正を超える B0 均一化を実現します。超高磁場における multi-coil B0 制御の中心的文献です。,,Juchem2011DynamicMultiShimmingHumanBrain,literature/paper-notes/imported/gradient-and-shim-coil-design-papers-since-1990/2011-juchem-dynamic-multi-shimming-human-brain.md,b0-field-control,other,localized-array,none-or-unspecified,human-brain;uhf,background,P2,unknown,not-needed,source-located,kb/hardware/design-methods.md;kb/hardware/b0-field-control.md
gradient-and-shim-coil-design-papers-since-1990,S16,Shim,2010 Jan,2010,A novel approach to designing cylindrical-surface shim coils for a superconducting magnet of magnetic resonance imaging,W.-T. Liu; D.-L. Zu; X. Tang,"Chinese Physics B, 19(1), 018701",10.1088/1674-1056/19/1/018701,https://doi.org/10.1088/1674-1056/19/1/018701,https://cpb.iphy.ac.cn/EN/10.1088/1674-1056/19/1/018701,This paper designs finite-length cylindrical gradient and shim coils by relating harmonic terms in cylindrical current distributions to spherical-harmonic field components. The method uses matrix inversion and stream functions to obtain discrete wire distributions without specifying target-field points. It is intended for pure-harmonic shim fields in superconducting MRI magnets.,円筒面上の電流分布の調和成分と、磁場の球面調和成分を関係づけ、有限長の円筒勾配・シムコイルを設計します。ターゲットフィールド点を設定せず、行列反転と stream function から離散巻線分布を得ます。超電導 MRI 磁石の純調和シム場生成を目的とした方法です。,,Liu2010NovelDesigningCylindricalSurfaceShim,literature/paper-notes/imported/gradient-and-shim-coil-design-papers-since-1990/2010-liu-novel-designing-cylindrical-surface-shim.md,b0-field-control,stream-function,cylindrical,none-or-unspecified,general-mri,background,P2,unknown,not-needed,source-located,kb/hardware/design-methods.md;kb/hardware/b0-field-control.md
gradient-and-shim-coil-design-papers-since-1990,S17,Shim,2010 Feb,2010,A novel target-field approach to design bi-planar shim coils for permanent-magnet MRI,W. Liu; X. Tang; D. Zu,"Concepts in Magnetic Resonance Part B, 37B(1), 29–38",10.1002/cmr.b.20153,https://doi.org/10.1002/cmr.b.20153,https://www.ovid.com/journals/cimrb/fulltext/10.1002/cmr.b.20153~a-novel-targetfield-approach-to-design-biplanar-shim-coils,"The paper adapts target-field design to biplanar shim coils for permanent-magnet MRI. It focuses on the open, planar geometry often used in permanent magnets and derives winding patterns that generate desired shim fields over the imaging region. The method is relevant to compact low-field systems where conventional cylindrical shims are unsuitable.",永久磁石 MRI 用のバイプラナ・シムコイルにターゲットフィールド設計を適用した論文です。永久磁石でよく用いられる開放的な平面形状を対象とし、撮像領域に必要なシム場を作る巻線パターンを導出します。従来の円筒シムが適さないコンパクト低磁場系に関係します。,,Liu2010NovelTargetFieldBiPlanar,literature/paper-notes/imported/gradient-and-shim-coil-design-papers-since-1990/2010-liu-novel-target-field-bi-planar.md,b0-field-control,target-field,biplanar,none-or-unspecified,permanent-magnet,direct,P0,purchase-required,candidate,source-located,kb/hardware/design-methods.md;kb/hardware/b0-field-control.md
